{
  "$schema": "https://json-schema.org/draft/2020-12/schema",
  "type": "object",
  "required": ["bundleId", "version", "sessionModel", "primaryArtifactId", "artifacts"],
  "properties": {
    "bundleId": { "type": "string" },
    "version": { "type": "string" },
    "sessionModel": { "type": "object" },
    "primaryArtifactId": { "type": "string" },
    "artifacts": { "type": "array", "minItems": 1 }
  },
  "additionalProperties": true
}
